{
  "schema-version": 1,
  "generated-at": "2026-05-06T17:31:34.496Z",
  "source-runtime-proof": "registry/runtime-proof.generated.json",
  "runtime-run-dir": "benchmark/host-smoke/runtime-runs",
  "run-count": 9,
  "artifact-error-count": 0,
  "latest-run": {
    "run-id": "host-smoke-20260506T173134494Z-codex",
    "executed-at": "2026-05-06T17:31:34.495Z",
    "host": "codex",
    "file": "benchmark/host-smoke/runtime-runs/host-smoke-20260506T173134494Z-codex.json"
  },
  "summary": {
    "host-smoke-capable-skills": 9,
    "levels": {
      "declared-only": 0,
      "declared-and-tested": 8,
      "host-smoked": 1
    },
    "evidence-status": {
      "passing": 8,
      "stale": 0,
      "failing": 0,
      "missing": 0,
      "contract-drift": 1,
      "invalid-contract": 0
    },
    "governance-status": {
      "satisfied": 1,
      "not-host-smoked": 8,
      "stale": 0,
      "failing": 0,
      "missing": 0,
      "contract-drift": 0,
      "invalid-contract": 0
    }
  },
  "artifact-errors": [],
  "skills": [
    {
      "skill": "gen-docs",
      "kind": "tool",
      "level": "declared-and-tested",
      "manifest": "skills/tools/gen-docs/scripts/smoke.json",
      "command-count": 1,
      "freshness-status": {
        "required": false,
        "fresh": true,
        "stale": false,
        "ageMs": null,
        "maxAgeMs": null
      },
      "evidence-status": "passing",
      "governance-status": "not-host-smoked",
      "latest-any-matches-contract": true,
      "latest-any": {
        "run-id": "host-smoke-20260506T141445Z-codex",
        "executed-at": "2026-05-06T14:14:45.221Z",
        "host": "codex",
        "status": "pass",
        "file": "benchmark/host-smoke/runtime-runs/host-smoke-20260506T141445Z-codex.json"
      },
      "latest-matching": {
        "run-id": "host-smoke-20260506T141445Z-codex",
        "executed-at": "2026-05-06T14:14:45.221Z",
        "host": "codex",
        "status": "pass",
        "file": "benchmark/host-smoke/runtime-runs/host-smoke-20260506T141445Z-codex.json"
      },
      "latest-passing": {
        "run-id": "host-smoke-20260506T141445Z-codex",
        "executed-at": "2026-05-06T14:14:45.221Z",
        "host": "codex",
        "status": "pass",
        "file": "benchmark/host-smoke/runtime-runs/host-smoke-20260506T141445Z-codex.json"
      }
    },
    {
      "skill": "manage-skill",
      "kind": "tool",
      "level": "declared-and-tested",
      "manifest": "skills/tools/manage-skill/scripts/smoke.json",
      "command-count": 1,
      "freshness": {
        "max-age": 7,
        "unit": "days"
      },
      "freshness-status": {
        "required": true,
        "fresh": true,
        "stale": false,
        "ageMs": 1,
        "maxAgeMs": 604800000
      },
      "evidence-status": "passing",
      "governance-status": "not-host-smoked",
      "latest-any-matches-contract": true,
      "latest-any": {
        "run-id": "host-smoke-20260506T173134494Z-codex",
        "executed-at": "2026-05-06T17:31:34.495Z",
        "host": "codex",
        "status": "pass",
        "file": "benchmark/host-smoke/runtime-runs/host-smoke-20260506T173134494Z-codex.json"
      },
      "latest-matching": {
        "run-id": "host-smoke-20260506T173134494Z-codex",
        "executed-at": "2026-05-06T17:31:34.495Z",
        "host": "codex",
        "status": "pass",
        "file": "benchmark/host-smoke/runtime-runs/host-smoke-20260506T173134494Z-codex.json"
      },
      "latest-passing": {
        "run-id": "host-smoke-20260506T173134494Z-codex",
        "executed-at": "2026-05-06T17:31:34.495Z",
        "host": "codex",
        "status": "pass",
        "file": "benchmark/host-smoke/runtime-runs/host-smoke-20260506T173134494Z-codex.json"
      }
    },
    {
      "skill": "pre-commit-gate",
      "kind": "guard",
      "level": "declared-and-tested",
      "manifest": "skills/guards/pre-commit-gate/scripts/smoke.json",
      "command-count": 1,
      "freshness-status": {
        "required": false,
        "fresh": true,
        "stale": false,
        "ageMs": null,
        "maxAgeMs": null
      },
      "evidence-status": "passing",
      "governance-status": "not-host-smoked",
      "latest-any-matches-contract": true,
      "latest-any": {
        "run-id": "host-smoke-20260506T141445Z-codex",
        "executed-at": "2026-05-06T14:14:45.221Z",
        "host": "codex",
        "status": "pass",
        "file": "benchmark/host-smoke/runtime-runs/host-smoke-20260506T141445Z-codex.json"
      },
      "latest-matching": {
        "run-id": "host-smoke-20260506T141445Z-codex",
        "executed-at": "2026-05-06T14:14:45.221Z",
        "host": "codex",
        "status": "pass",
        "file": "benchmark/host-smoke/runtime-runs/host-smoke-20260506T141445Z-codex.json"
      },
      "latest-passing": {
        "run-id": "host-smoke-20260506T141445Z-codex",
        "executed-at": "2026-05-06T14:14:45.221Z",
        "host": "codex",
        "status": "pass",
        "file": "benchmark/host-smoke/runtime-runs/host-smoke-20260506T141445Z-codex.json"
      }
    },
    {
      "skill": "pre-merge-gate",
      "kind": "guard",
      "level": "declared-and-tested",
      "manifest": "skills/guards/pre-merge-gate/scripts/smoke.json",
      "command-count": 1,
      "freshness-status": {
        "required": false,
        "fresh": true,
        "stale": false,
        "ageMs": null,
        "maxAgeMs": null
      },
      "evidence-status": "passing",
      "governance-status": "not-host-smoked",
      "latest-any-matches-contract": true,
      "latest-any": {
        "run-id": "host-smoke-20260506T141445Z-codex",
        "executed-at": "2026-05-06T14:14:45.221Z",
        "host": "codex",
        "status": "pass",
        "file": "benchmark/host-smoke/runtime-runs/host-smoke-20260506T141445Z-codex.json"
      },
      "latest-matching": {
        "run-id": "host-smoke-20260506T141445Z-codex",
        "executed-at": "2026-05-06T14:14:45.221Z",
        "host": "codex",
        "status": "pass",
        "file": "benchmark/host-smoke/runtime-runs/host-smoke-20260506T141445Z-codex.json"
      },
      "latest-passing": {
        "run-id": "host-smoke-20260506T141445Z-codex",
        "executed-at": "2026-05-06T14:14:45.221Z",
        "host": "codex",
        "status": "pass",
        "file": "benchmark/host-smoke/runtime-runs/host-smoke-20260506T141445Z-codex.json"
      }
    },
    {
      "skill": "verify-change",
      "kind": "tool",
      "level": "declared-and-tested",
      "manifest": "skills/tools/verify-change/scripts/smoke.json",
      "command-count": 1,
      "freshness-status": {
        "required": false,
        "fresh": true,
        "stale": false,
        "ageMs": null,
        "maxAgeMs": null
      },
      "evidence-status": "passing",
      "governance-status": "not-host-smoked",
      "latest-any-matches-contract": true,
      "latest-any": {
        "run-id": "host-smoke-20260506T141445Z-codex",
        "executed-at": "2026-05-06T14:14:45.221Z",
        "host": "codex",
        "status": "pass",
        "file": "benchmark/host-smoke/runtime-runs/host-smoke-20260506T141445Z-codex.json"
      },
      "latest-matching": {
        "run-id": "host-smoke-20260506T141445Z-codex",
        "executed-at": "2026-05-06T14:14:45.221Z",
        "host": "codex",
        "status": "pass",
        "file": "benchmark/host-smoke/runtime-runs/host-smoke-20260506T141445Z-codex.json"
      },
      "latest-passing": {
        "run-id": "host-smoke-20260506T141445Z-codex",
        "executed-at": "2026-05-06T14:14:45.221Z",
        "host": "codex",
        "status": "pass",
        "file": "benchmark/host-smoke/runtime-runs/host-smoke-20260506T141445Z-codex.json"
      }
    },
    {
      "skill": "verify-module",
      "kind": "tool",
      "level": "declared-and-tested",
      "manifest": "skills/tools/verify-module/scripts/smoke.json",
      "command-count": 1,
      "freshness-status": {
        "required": false,
        "fresh": true,
        "stale": false,
        "ageMs": null,
        "maxAgeMs": null
      },
      "evidence-status": "passing",
      "governance-status": "not-host-smoked",
      "latest-any-matches-contract": true,
      "latest-any": {
        "run-id": "host-smoke-20260506T141445Z-codex",
        "executed-at": "2026-05-06T14:14:45.221Z",
        "host": "codex",
        "status": "pass",
        "file": "benchmark/host-smoke/runtime-runs/host-smoke-20260506T141445Z-codex.json"
      },
      "latest-matching": {
        "run-id": "host-smoke-20260506T141445Z-codex",
        "executed-at": "2026-05-06T14:14:45.221Z",
        "host": "codex",
        "status": "pass",
        "file": "benchmark/host-smoke/runtime-runs/host-smoke-20260506T141445Z-codex.json"
      },
      "latest-passing": {
        "run-id": "host-smoke-20260506T141445Z-codex",
        "executed-at": "2026-05-06T14:14:45.221Z",
        "host": "codex",
        "status": "pass",
        "file": "benchmark/host-smoke/runtime-runs/host-smoke-20260506T141445Z-codex.json"
      }
    },
    {
      "skill": "verify-quality",
      "kind": "tool",
      "level": "host-smoked",
      "manifest": "skills/tools/verify-quality/scripts/smoke.json",
      "command-count": 1,
      "freshness": {
        "max-age": 7,
        "unit": "days"
      },
      "freshness-status": {
        "required": true,
        "fresh": true,
        "stale": false,
        "ageMs": 350217,
        "maxAgeMs": 604800000
      },
      "evidence-status": "passing",
      "governance-status": "satisfied",
      "latest-any-matches-contract": true,
      "latest-any": {
        "run-id": "host-smoke-20260506T172544279Z-codex",
        "executed-at": "2026-05-06T17:25:44.279Z",
        "host": "codex",
        "status": "pass",
        "file": "benchmark/host-smoke/runtime-runs/host-smoke-20260506T172544279Z-codex.json"
      },
      "latest-matching": {